{
  "otf_version": "1.0",
  "metadata": {
    "title": "Conformance",
    "time_signature": "4/4",
    "tempo": 100,
    "key": "G",
    "composer": "Trad.",
    "time_signature_changes": [
      {
        "measure": 2,
        "time_signature": "2/4"
      }
    ]
  },
  "timing": {
    "ticks_per_beat": 480
  },
  "tracks": [
    {
      "id": "banjo",
      "instrument": "5-string-banjo",
      "tuning": [
        "D4",
        "B3",
        "G3",
        "D3",
        "G4"
      ],
      "capo": 0,
      "role": "lead"
    }
  ],
  "notation": {
    "banjo": [
      {
        "measure": 1,
        "events": [
          {
            "tick": 0,
            "notes": [
              {
                "s": 1,
                "f": 0,
                "dur": 240,
                "tie": true,
                "tech": "h",
                "fx": [
                  "brush",
                  "let-ring"
                ],
                "grace": {
                  "f": 2,
                  "kind": "slide"
                },
                "finger": "T",
                "lh": 0
              }
            ]
          },
          {
            "tick": 480,
            "notes": [
              {
                "s": 2,
                "f": 2,
                "dur": 240
              },
              {
                "s": 3,
                "f": 0,
                "dur": 240
              }
            ]
          }
        ]
      },
      {
        "measure": 2,
        "events": [
          {
            "tick": 480,
            "notes": [
              {
                "s": 5,
                "f": 0,
                "dur": 480
              }
            ]
          }
        ]
      }
    ]
  },
  "annotations": [
    {
      "measure": 1,
      "tick": 0,
      "text": "G"
    }
  ],
  "reading_list": [
    {
      "from_measure": 1,
      "to_measure": 2,
      "name": "A part"
    }
  ],
  "x_source": {
    "type": "tef",
    "anything": [
      "goes",
      {
        "here": 1
      }
    ]
  }
}
