{
  "otf_version": "1.0",
  "metadata": {
    "title": "Reuben",
    "time_signature": "4/4",
    "tempo": 254,
    "key": "D"
  },
  "timing": {
    "ticks_per_beat": 480
  },
  "tracks": [
    {
      "id": "banjo",
      "instrument": "5-string-banjo",
      "tuning": ["D4", "A3", "F#3", "D3", "F#4"],
      "capo": 0,
      "role": "lead"
    }
  ],
  "notation": {
    "banjo": [
      {
        "measure": 1,
        "events": [
          {"tick": 0, "notes": [{"s": 1, "f": 0, "dur": 960}, {"s": 2, "f": 0, "dur": 960}, {"s": 5, "f": 0, "dur": 960}]},
          {"tick": 960, "notes": [{"s": 4, "f": 0, "dur": 480}]},
          {"tick": 1440, "notes": [{"s": 1, "f": 0, "dur": 480}, {"s": 5, "f": 0, "dur": 480}]}
        ]
      },
      {
        "measure": 2,
        "events": [
          {"tick": 0, "notes": [{"s": 3, "f": 2, "dur": 240}]},
          {"tick": 240, "notes": [{"s": 3, "f": 3, "dur": 30, "tech": "/"}]},
          {"tick": 270, "notes": [{"s": 2, "f": 0, "dur": 210}]},
          {"tick": 480, "notes": [{"s": 5, "f": 0, "dur": 240}]},
          {"tick": 750, "notes": [{"s": 1, "f": 0, "dur": 210}]},
          {"tick": 960, "notes": [{"s": 3, "f": 3, "dur": 210}]},
          {"tick": 1170, "notes": [{"s": 3, "f": 2, "dur": 60, "tech": "p"}]},
          {"tick": 1230, "notes": [{"s": 2, "f": 0, "dur": 210}]},
          {"tick": 1440, "notes": [{"s": 3, "f": 0, "dur": 240}]},
          {"tick": 1710, "notes": [{"s": 1, "f": 0, "dur": 210}]}
        ]
      },
      {
        "measure": 3,
        "events": [
          {"tick": 0, "notes": [{"s": 3, "f": 2, "dur": 240}]},
          {"tick": 240, "notes": [{"s": 3, "f": 3, "dur": 30, "tech": "/"}]},
          {"tick": 270, "notes": [{"s": 2, "f": 0, "dur": 210}]},
          {"tick": 480, "notes": [{"s": 5, "f": 0, "dur": 240}]},
          {"tick": 750, "notes": [{"s": 1, "f": 0, "dur": 210}]},
          {"tick": 960, "notes": [{"s": 4, "f": 0, "dur": 240}]},
          {"tick": 1230, "notes": [{"s": 2, "f": 0, "dur": 210}]},
          {"tick": 1440, "notes": [{"s": 3, "f": 0, "dur": 240}]},
          {"tick": 1710, "notes": [{"s": 1, "f": 0, "dur": 210}]}
        ]
      },
      {
        "measure": 4,
        "events": [
          {"tick": 0, "notes": [{"s": 3, "f": 2, "dur": 240}]},
          {"tick": 240, "notes": [{"s": 3, "f": 3, "dur": 30, "tech": "/"}]},
          {"tick": 270, "notes": [{"s": 2, "f": 0, "dur": 210}]},
          {"tick": 480, "notes": [{"s": 5, "f": 0, "dur": 240}]},
          {"tick": 750, "notes": [{"s": 1, "f": 0, "dur": 210}]},
          {"tick": 960, "notes": [{"s": 3, "f": 3, "dur": 210}]},
          {"tick": 1170, "notes": [{"s": 3, "f": 2, "dur": 60, "tech": "p"}]},
          {"tick": 1230, "notes": [{"s": 2, "f": 0, "dur": 210}]},
          {"tick": 1440, "notes": [{"s": 3, "f": 0, "dur": 240}]},
          {"tick": 1710, "notes": [{"s": 1, "f": 0, "dur": 210}]}
        ]
      },
      {
        "measure": 5,
        "events": [
          {"tick": 0, "notes": [{"s": 4, "f": 0, "dur": 480}]},
          {"tick": 480, "notes": [{"s": 1, "f": 0, "dur": 480}, {"s": 5, "f": 0, "dur": 480}]},
          {"tick": 960, "notes": [{"s": 2, "f": 0, "dur": 480}]},
          {"tick": 1440, "notes": [{"s": 1, "f": 0, "dur": 480}, {"s": 5, "f": 0, "dur": 480}]}
        ]
      },
      {
        "measure": 6,
        "events": [
          {"tick": 0, "notes": [{"s": 3, "f": 2, "dur": 240}]},
          {"tick": 240, "notes": [{"s": 3, "f": 3, "dur": 30, "tech": "/"}]},
          {"tick": 270, "notes": [{"s": 2, "f": 0, "dur": 210}]},
          {"tick": 480, "notes": [{"s": 1, "f": 0, "dur": 240}]},
          {"tick": 750, "notes": [{"s": 5, "f": 0, "dur": 210}]},
          {"tick": 960, "notes": [{"s": 1, "f": 0, "dur": 240}]},
          {"tick": 1230, "notes": [{"s": 2, "f": 0, "dur": 210}]},
          {"tick": 1440, "notes": [{"s": 3, "f": 3, "dur": 210}]},
          {"tick": 1650, "notes": [{"s": 3, "f": 2, "dur": 60, "tech": "p"}]},
          {"tick": 1710, "notes": [{"s": 1, "f": 0, "dur": 210}]}
        ]
      },
      {
        "measure": 7,
        "events": [
          {"tick": 0, "notes": [{"s": 3, "f": 0, "dur": 240}]},
          {"tick": 270, "notes": [{"s": 2, "f": 0, "dur": 210}]},
          {"tick": 480, "notes": [{"s": 4, "f": 0, "dur": 240}]},
          {"tick": 750, "notes": [{"s": 1, "f": 0, "dur": 210}]},
          {"tick": 960, "notes": [{"s": 3, "f": 3, "dur": 210}]},
          {"tick": 1170, "notes": [{"s": 3, "f": 2, "dur": 60, "tech": "p"}]},
          {"tick": 1230, "notes": [{"s": 2, "f": 0, "dur": 210}]},
          {"tick": 1440, "notes": [{"s": 3, "f": 0, "dur": 240}]},
          {"tick": 1710, "notes": [{"s": 1, "f": 0, "dur": 210}]}
        ]
      },
      {
        "measure": 8,
        "events": [
          {"tick": 0, "notes": [{"s": 4, "f": 0, "dur": 480}]},
          {"tick": 480, "notes": [{"s": 5, "f": 0, "dur": 240}]},
          {"tick": 750, "notes": [{"s": 2, "f": 0, "dur": 210}]},
          {"tick": 960, "notes": [{"s": 1, "f": 0, "dur": 240}]},
          {"tick": 1230, "notes": [{"s": 3, "f": 0, "dur": 210}]},
          {"tick": 1440, "notes": [{"s": 4, "f": 2, "dur": 180}]},
          {"tick": 1620, "notes": [{"s": 4, "f": 3, "dur": 90, "tech": "/"}]},
          {"tick": 1710, "notes": [{"s": 1, "f": 0, "dur": 210}]}
        ]
      },
      {
        "measure": 9,
        "events": [
          {"tick": 0, "notes": [{"s": 4, "f": 0, "dur": 480}]},
          {"tick": 480, "notes": [{"s": 1, "f": 0, "dur": 480}, {"s": 5, "f": 0, "dur": 480}]},
          {"tick": 960, "notes": [{"s": 2, "f": 0, "dur": 480}]},
          {"tick": 1440, "notes": [{"s": 1, "f": 0, "dur": 480}, {"s": 5, "f": 0, "dur": 480}]}
        ]
      }
    ]
  },
  "reading_list": [
    {"from_measure": 1, "to_measure": 9},
    {"from_measure": 2, "to_measure": 9}
  ],
  "x_source": {
    "type": "banjo-hangout",
    "source_id": "12131",
    "url": "https://www.hangoutstorage.com/banjohangout.org/storage/tabs/r/tab-reuben-12131-471225112009.tef",
    "download_file": "12131_tef_reuben.tef",
    "author": "5th string nut",
    "converted_at": "2026-08-01T11:11:13.097735"
  }
}
