{
  "otf_version": "1.0",
  "metadata": {
    "title": "Sail Away Ladies",
    "time_signature": "4/4",
    "tempo": 230,
    "composer": "clawhammer"
  },
  "timing": {
    "ticks_per_beat": 480
  },
  "tracks": [
    {
      "id": "banjo",
      "instrument": "5-string-banjo",
      "tuning": ["D4", "B3", "G3", "D3", "G4"],
      "capo": 0,
      "role": "lead"
    }
  ],
  "notation": {
    "banjo": [
      {
        "measure": 1,
        "events": [
          {"tick": 720, "notes": [{"s": 2, "f": 5}]},
          {"tick": 840, "notes": [{"s": 2, "f": 7}]}
        ]
      },
      {
        "measure": 2,
        "events": [
          {"tick": 0, "notes": [{"s": 1, "f": 5}]},
          {"tick": 240, "notes": [{"s": 1, "f": 5}]},
          {"tick": 360, "notes": [{"s": 1, "f": 7}]},
          {"tick": 480, "notes": [{"s": 1, "f": 5}]},
          {"tick": 600, "notes": [{"s": 2, "f": 5}]},
          {"tick": 720, "notes": [{"s": 1, "f": 0}, {"s": 2, "f": 0}]},
          {"tick": 840, "notes": [{"s": 5, "f": 0}]}
        ]
      },
      {
        "measure": 3,
        "events": [
          {"tick": 0, "notes": [{"s": 1, "f": 2}]},
          {"tick": 240, "notes": [{"s": 1, "f": 2}]},
          {"tick": 360, "notes": [{"s": 1, "f": 4}]},
          {"tick": 480, "notes": [{"s": 1, "f": 2}]},
          {"tick": 720, "notes": [{"s": 1, "f": 2}, {"s": 2, "f": 0}]},
          {"tick": 840, "notes": [{"s": 5, "f": 0}]}
        ]
      },
      {
        "measure": 4,
        "events": [
          {"tick": 0, "notes": [{"s": 1, "f": 5}]},
          {"tick": 120, "notes": [{"s": 1, "f": 4}]},
          {"tick": 240, "notes": [{"s": 1, "f": 5}]},
          {"tick": 360, "notes": [{"s": 1, "f": 7}]},
          {"tick": 480, "notes": [{"s": 1, "f": 5}]},
          {"tick": 600, "notes": [{"s": 2, "f": 5}]},
          {"tick": 720, "notes": [{"s": 1, "f": 0}, {"s": 2, "f": 0}]},
          {"tick": 840, "notes": [{"s": 5, "f": 0}]}
        ]
      },
      {
        "measure": 5,
        "events": [
          {"tick": 0, "notes": [{"s": 1, "f": 0}]},
          {"tick": 240, "notes": [{"s": 1, "f": 0}, {"s": 2, "f": 0}]},
          {"tick": 360, "notes": [{"s": 5, "f": 0}]},
          {"tick": 480, "notes": [{"s": 1, "f": 0}]},
          {"tick": 720, "notes": [{"s": 2, "f": 0}]},
          {"tick": 840, "notes": [{"s": 2, "f": 1}]}
        ]
      },
      {
        "measure": 6,
        "events": [
          {"tick": 0, "notes": [{"s": 1, "f": 0}]},
          {"tick": 120, "notes": [{"s": 2, "f": 2}]},
          {"tick": 240, "notes": [{"s": 1, "f": 0}]},
          {"tick": 360, "notes": [{"s": 1, "f": 2}]},
          {"tick": 480, "notes": [{"s": 1, "f": 0}]},
          {"tick": 600, "notes": [{"s": 2, "f": 0}]},
          {"tick": 720, "notes": [{"s": 3, "f": 2}]},
          {"tick": 840, "notes": [{"s": 3, "f": 0}]}
        ]
      },
      {
        "measure": 7,
        "events": [
          {"tick": 0, "notes": [{"s": 4, "f": 2}]},
          {"tick": 120, "notes": [{"s": 3, "f": 2}]},
          {"tick": 360, "notes": [{"s": 4, "f": 2}]},
          {"tick": 480, "notes": [{"s": 3, "f": 2}]},
          {"tick": 720, "notes": [{"s": 1, "f": 2}, {"s": 2, "f": 1}, {"s": 3, "f": 2}]},
          {"tick": 840, "notes": [{"s": 5, "f": 0}]}
        ]
      },
      {
        "measure": 8,
        "events": [
          {"tick": 0, "notes": [{"s": 3, "f": 2}]},
          {"tick": 120, "notes": [{"s": 3, "f": 0}]},
          {"tick": 240, "notes": [{"s": 3, "f": 2}]},
          {"tick": 360, "notes": [{"s": 3, "f": 4}]},
          {"tick": 480, "notes": [{"s": 3, "f": 2}]},
          {"tick": 600, "notes": [{"s": 3, "f": 0}]},
          {"tick": 720, "notes": [{"s": 4, "f": 2}]},
          {"tick": 840, "notes": [{"s": 4, "f": 0}]}
        ]
      },
      {
        "measure": 9,
        "events": [
          {"tick": 0, "notes": [{"s": 3, "f": 0}]},
          {"tick": 240, "notes": [{"s": 1, "f": 0}, {"s": 2, "f": 0}]},
          {"tick": 360, "notes": [{"s": 5, "f": 0}]},
          {"tick": 480, "notes": [{"s": 3, "f": 0}]},
          {"tick": 720, "notes": [{"s": 2, "f": 5}]},
          {"tick": 840, "notes": [{"s": 2, "f": 7}]}
        ]
      },
      {
        "measure": 10,
        "events": [
          {"tick": 0, "notes": [{"s": 3, "f": 0}]},
          {"tick": 240, "notes": [{"s": 1, "f": 0}, {"s": 2, "f": 0}]},
          {"tick": 360, "notes": [{"s": 5, "f": 0}]},
          {"tick": 480, "notes": [{"s": 3, "f": 0}]},
          {"tick": 720, "notes": [{"s": 3, "f": 0}]},
          {"tick": 840, "notes": [{"s": 4, "f": 2}]}
        ]
      },
      {
        "measure": 11,
        "events": [
          {"tick": 0, "notes": [{"s": 4, "f": 0}]},
          {"tick": 240, "notes": [{"s": 1, "f": 0}, {"s": 2, "f": 0}, {"s": 3, "f": 0}, {"s": 4, "f": 0}]},
          {"tick": 360, "notes": [{"s": 5, "f": 0}]},
          {"tick": 480, "notes": [{"s": 4, "f": 2}]},
          {"tick": 720, "notes": [{"s": 1, "f": 0}, {"s": 2, "f": 0}, {"s": 3, "f": 0}]},
          {"tick": 840, "notes": [{"s": 5, "f": 0}]}
        ]
      },
      {
        "measure": 12,
        "events": [
          {"tick": 0, "notes": [{"s": 3, "f": 2}]},
          {"tick": 120, "notes": [{"s": 3, "f": 0}]},
          {"tick": 240, "notes": [{"s": 3, "f": 2}]},
          {"tick": 360, "notes": [{"s": 3, "f": 4}]},
          {"tick": 480, "notes": [{"s": 3, "f": 2}]},
          {"tick": 720, "notes": [{"s": 1, "f": 2}, {"s": 2, "f": 1}, {"s": 3, "f": 2}]},
          {"tick": 840, "notes": [{"s": 5, "f": 0}]}
        ]
      },
      {
        "measure": 13,
        "events": [
          {"tick": 0, "notes": [{"s": 3, "f": 2}]},
          {"tick": 120, "notes": [{"s": 3, "f": 0}]},
          {"tick": 240, "notes": [{"s": 3, "f": 2}]},
          {"tick": 360, "notes": [{"s": 3, "f": 4}]},
          {"tick": 480, "notes": [{"s": 3, "f": 2}]},
          {"tick": 600, "notes": [{"s": 3, "f": 0}]},
          {"tick": 720, "notes": [{"s": 4, "f": 2}]},
          {"tick": 840, "notes": [{"s": 4, "f": 0}]}
        ]
      },
      {
        "measure": 14,
        "events": [
          {"tick": 0, "notes": [{"s": 3, "f": 0}]},
          {"tick": 120, "notes": [{"s": 5, "f": 0}]},
          {"tick": 240, "notes": [{"s": 1, "f": 0}]},
          {"tick": 360, "notes": [{"s": 5, "f": 0}]},
          {"tick": 480, "notes": [{"s": 3, "f": 0}]},
          {"tick": 720, "notes": [{"s": 3, "f": 0}]},
          {"tick": 840, "notes": [{"s": 4, "f": 2}]}
        ]
      },
      {
        "measure": 15,
        "events": [
          {"tick": 0, "notes": [{"s": 4, "f": 0}]},
          {"tick": 120, "notes": [{"s": 4, "f": 2}]},
          {"tick": 240, "notes": [{"s": 3, "f": 0}]},
          {"tick": 360, "notes": [{"s": 3, "f": 2}]},
          {"tick": 480, "notes": [{"s": 2, "f": 0}]},
          {"tick": 600, "notes": [{"s": 3, "f": 2}]},
          {"tick": 720, "notes": [{"s": 3, "f": 0}]},
          {"tick": 840, "notes": [{"s": 2, "f": 0}]}
        ]
      },
      {
        "measure": 16,
        "events": [
          {"tick": 0, "notes": [{"s": 3, "f": 2}]},
          {"tick": 120, "notes": [{"s": 3, "f": 0}]},
          {"tick": 240, "notes": [{"s": 3, "f": 2}]},
          {"tick": 360, "notes": [{"s": 3, "f": 4}]},
          {"tick": 480, "notes": [{"s": 3, "f": 2}]},
          {"tick": 720, "notes": [{"s": 1, "f": 2}, {"s": 2, "f": 1}, {"s": 3, "f": 2}]},
          {"tick": 840, "notes": [{"s": 5, "f": 0}]}
        ]
      },
      {
        "measure": 17,
        "events": [
          {"tick": 0, "notes": [{"s": 3, "f": 2}]},
          {"tick": 120, "notes": [{"s": 3, "f": 0}]},
          {"tick": 240, "notes": [{"s": 3, "f": 2}]},
          {"tick": 360, "notes": [{"s": 3, "f": 4}]},
          {"tick": 480, "notes": [{"s": 3, "f": 2}]},
          {"tick": 600, "notes": [{"s": 3, "f": 0}]},
          {"tick": 720, "notes": [{"s": 4, "f": 2}]},
          {"tick": 840, "notes": [{"s": 4, "f": 0}]}
        ]
      },
      {
        "measure": 18,
        "events": [
          {"tick": 0, "notes": [{"s": 3, "f": 0}]},
          {"tick": 240, "notes": [{"s": 1, "f": 0}, {"s": 2, "f": 0}]},
          {"tick": 360, "notes": [{"s": 5, "f": 0}]},
          {"tick": 480, "notes": [{"s": 3, "f": 0}]},
          {"tick": 720, "notes": [{"s": 3, "f": 0}]},
          {"tick": 840, "notes": [{"s": 4, "f": 2}]}
        ]
      },
      {
        "measure": 19,
        "events": [
          {"tick": 0, "notes": [{"s": 3, "f": 0}]},
          {"tick": 240, "notes": [{"s": 1, "f": 0}, {"s": 2, "f": 0}]},
          {"tick": 360, "notes": [{"s": 5, "f": 0}]},
          {"tick": 480, "notes": [{"s": 3, "f": 0}]}
        ]
      }
    ]
  },
  "x_source": {
    "type": "banjo-hangout",
    "url": "https://www.hangoutstorage.com/banjohangout.org/storage/tabs/s/tab-sail-away-ladie-16633-352131512012.tef",
    "author": "Julian44_4",
    "converted_at": "2026-01-03T22:37:36.749821",
    "source_id": "16633"
  }
}
