{
  "otf_version": "1.0",
  "metadata": {
    "title": "Banjo in the Hollow",
    "time_signature": "4/4",
    "tempo": 240
  },
  "timing": {
    "ticks_per_beat": 480
  },
  "tracks": [
    {
      "id": "tenor-banjo",
      "instrument": "tenor-banjo",
      "tuning": ["G4", "D4", "G3", "D3"],
      "capo": 0,
      "role": "lead"
    }
  ],
  "notation": {
    "tenor-banjo": [
      {
        "measure": 1,
        "events": [
          {"tick": 0, "notes": [{"s": 1, "f": 0, "dur": 240, "finger": "M"}]},
          {"tick": 240, "notes": [{"s": 3, "f": 14, "dur": 240, "finger": "T"}]},
          {"tick": 480, "notes": [{"s": 2, "f": 9, "dur": 240, "finger": "I"}]},
          {"tick": 720, "notes": [{"s": 1, "f": 0, "dur": 240, "finger": "M"}]},
          {"tick": 960, "notes": [{"s": 2, "f": 0, "dur": 240, "finger": "I"}]},
          {"tick": 1200, "notes": [{"s": 4, "f": 9, "dur": 240, "finger": "T"}]},
          {"tick": 1440, "notes": [{"s": 3, "f": 0, "dur": 240, "finger": "I"}]},
          {"tick": 1680, "notes": [{"s": 2, "f": 0, "dur": 240, "finger": "M"}]}
        ]
      },
      {
        "measure": 2,
        "events": [
          {"tick": 0, "notes": [{"s": 4, "f": 10, "dur": 240, "finger": "T"}]},
          {"tick": 240, "notes": [{"s": 3, "f": 9, "dur": 240, "finger": "I"}]},
          {"tick": 480, "notes": [{"s": 1, "f": 0, "dur": 240, "finger": "M"}]},
          {"tick": 720, "notes": [{"s": 3, "f": 12, "dur": 240, "finger": "T"}]},
          {"tick": 960, "notes": [{"s": 2, "f": 0, "dur": 240, "finger": "I"}]},
          {"tick": 1200, "notes": [{"s": 4, "f": 9, "dur": 240, "finger": "T"}]},
          {"tick": 1440, "notes": [{"s": 3, "f": 0, "dur": 240, "finger": "I"}]},
          {"tick": 1680, "notes": [{"s": 2, "f": 0, "dur": 240, "finger": "T"}]}
        ]
      },
      {
        "measure": 3,
        "events": [
          {"tick": 0, "notes": [{"s": 1, "f": 0, "dur": 240, "finger": "M"}]},
          {"tick": 240, "notes": [{"s": 3, "f": 14, "dur": 240, "finger": "T"}]},
          {"tick": 480, "notes": [{"s": 2, "f": 9, "dur": 240, "finger": "I"}]},
          {"tick": 720, "notes": [{"s": 1, "f": 0, "dur": 240, "finger": "M"}]},
          {"tick": 960, "notes": [{"s": 2, "f": 0, "dur": 240, "finger": "I"}]},
          {"tick": 1200, "notes": [{"s": 4, "f": 9, "dur": 240, "finger": "T"}]},
          {"tick": 1440, "notes": [{"s": 3, "f": 0, "dur": 240, "finger": "I"}]},
          {"tick": 1680, "notes": [{"s": 4, "f": 12, "dur": 240, "finger": "T"}]}
        ]
      },
      {
        "measure": 4,
        "events": [
          {"tick": 0, "notes": [{"s": 2, "f": 0, "dur": 240, "finger": "I"}]},
          {"tick": 240, "notes": [{"s": 3, "f": 11, "dur": 240, "finger": "T"}]},
          {"tick": 480, "notes": [{"s": 2, "f": 7, "dur": 240, "finger": "I"}]},
          {"tick": 720, "notes": [{"s": 1, "f": 0, "dur": 240, "finger": "M"}]},
          {"tick": 960, "notes": [{"s": 2, "f": 0, "dur": 480, "finger": "T"}]},
          {"tick": 1440, "notes": [{"s": 1, "f": 0, "dur": 480, "finger": "M"}, {"s": 2, "f": 0, "dur": 480, "finger": "I"}]}
        ]
      },
      {
        "measure": 5,
        "events": [
          {"tick": 0, "notes": [{"s": 1, "f": 0, "dur": 240, "finger": "M"}]},
          {"tick": 240, "notes": [{"s": 4, "f": 10, "dur": 240, "finger": "T"}]},
          {"tick": 480, "notes": [{"s": 3, "f": 9, "dur": 240, "finger": "I"}]},
          {"tick": 720, "notes": [{"s": 1, "f": 0, "dur": 240, "finger": "M"}]},
          {"tick": 960, "notes": [{"s": 2, "f": 0, "dur": 240, "finger": "I"}]},
          {"tick": 1200, "notes": [{"s": 4, "f": 9, "dur": 240, "finger": "T"}]},
          {"tick": 1440, "notes": [{"s": 3, "f": 0, "dur": 240, "finger": "I"}]},
          {"tick": 1680, "notes": [{"s": 2, "f": 0, "dur": 240, "finger": "T"}]}
        ]
      },
      {
        "measure": 6,
        "events": [
          {"tick": 0, "notes": [{"s": 1, "f": 0, "dur": 240, "finger": "M"}]},
          {"tick": 240, "notes": [{"s": 4, "f": 10, "dur": 240, "finger": "T"}]},
          {"tick": 480, "notes": [{"s": 3, "f": 9, "dur": 240, "finger": "I"}]},
          {"tick": 720, "notes": [{"s": 1, "f": 0, "dur": 240, "finger": "M"}]},
          {"tick": 960, "notes": [{"s": 2, "f": 0, "dur": 480, "finger": "T"}]},
          {"tick": 1440, "notes": [{"s": 1, "f": 0, "dur": 480, "finger": "M"}, {"s": 2, "f": 0, "dur": 480, "finger": "I"}]}
        ]
      },
      {
        "measure": 7,
        "events": [
          {"tick": 0, "notes": [{"s": 1, "f": 0, "dur": 240, "finger": "M"}]},
          {"tick": 240, "notes": [{"s": 4, "f": 10, "dur": 240, "finger": "T"}]},
          {"tick": 480, "notes": [{"s": 3, "f": 9, "dur": 240, "finger": "I"}]},
          {"tick": 720, "notes": [{"s": 1, "f": 0, "dur": 240, "finger": "M"}]},
          {"tick": 960, "notes": [{"s": 2, "f": 0, "dur": 240, "finger": "I"}]},
          {"tick": 1200, "notes": [{"s": 4, "f": 9, "dur": 240, "finger": "T"}]},
          {"tick": 1440, "notes": [{"s": 3, "f": 0, "dur": 240, "finger": "I"}]},
          {"tick": 1680, "notes": [{"s": 2, "f": 0, "dur": 240, "finger": "M"}]}
        ]
      },
      {
        "measure": 8,
        "events": [
          {"tick": 0, "notes": [{"s": 4, "f": 7, "dur": 240, "finger": "T"}]},
          {"tick": 240, "notes": [{"s": 3, "f": 5, "dur": 240, "finger": "I"}]},
          {"tick": 480, "notes": [{"s": 2, "f": 0, "dur": 240, "finger": "T"}]},
          {"tick": 720, "notes": [{"s": 1, "f": 0, "dur": 240, "finger": "M"}]},
          {"tick": 960, "notes": [{"s": 2, "f": 0, "dur": 240, "finger": "T"}]},
          {"tick": 1200, "notes": [{"s": 3, "f": 5, "dur": 240, "finger": "I"}]},
          {"tick": 1440, "notes": [{"s": 4, "f": 7, "dur": 240, "finger": "T"}]},
          {"tick": 1680, "notes": [{"s": 2, "f": 0, "dur": 240, "finger": "I"}]}
        ]
      },
      {
        "measure": 9,
        "events": [
          {"tick": 0, "notes": [{"s": 1, "f": 0, "dur": 240, "finger": "M"}]},
          {"tick": 240, "notes": [{"s": 4, "f": 10, "dur": 240, "finger": "T"}]},
          {"tick": 480, "notes": [{"s": 3, "f": 9, "dur": 240, "finger": "I"}]},
          {"tick": 720, "notes": [{"s": 1, "f": 0, "dur": 240, "finger": "M"}]},
          {"tick": 960, "notes": [{"s": 2, "f": 0, "dur": 240, "finger": "I"}]},
          {"tick": 1200, "notes": [{"s": 4, "f": 9, "dur": 240, "finger": "T"}]},
          {"tick": 1440, "notes": [{"s": 3, "f": 0, "dur": 240, "finger": "I"}]},
          {"tick": 1680, "notes": [{"s": 2, "f": 0, "dur": 240, "finger": "T"}]}
        ]
      },
      {
        "measure": 10,
        "events": [
          {"tick": 0, "notes": [{"s": 1, "f": 0, "dur": 240, "finger": "M"}]},
          {"tick": 240, "notes": [{"s": 4, "f": 10, "dur": 240, "finger": "T"}]},
          {"tick": 480, "notes": [{"s": 3, "f": 9, "dur": 240, "finger": "I"}]},
          {"tick": 720, "notes": [{"s": 1, "f": 0, "dur": 240, "finger": "M"}]},
          {"tick": 960, "notes": [{"s": 2, "f": 0, "dur": 480, "finger": "T"}]},
          {"tick": 1440, "notes": [{"s": 1, "f": 0, "dur": 480, "finger": "M"}, {"s": 2, "f": 0, "dur": 480, "finger": "I"}]}
        ]
      },
      {
        "measure": 11,
        "events": [
          {"tick": 0, "notes": [{"s": 1, "f": 0, "dur": 240, "finger": "M"}]},
          {"tick": 240, "notes": [{"s": 4, "f": 10, "dur": 240, "finger": "T"}]},
          {"tick": 480, "notes": [{"s": 3, "f": 9, "dur": 240, "finger": "I"}]},
          {"tick": 720, "notes": [{"s": 1, "f": 0, "dur": 240, "finger": "M"}]},
          {"tick": 960, "notes": [{"s": 2, "f": 0, "dur": 240, "finger": "I"}]},
          {"tick": 1200, "notes": [{"s": 4, "f": 9, "dur": 240, "finger": "T"}]},
          {"tick": 1440, "notes": [{"s": 3, "f": 0, "dur": 240, "finger": "I"}]},
          {"tick": 1680, "notes": [{"s": 2, "f": 0, "dur": 240, "finger": "M"}]}
        ]
      },
      {
        "measure": 12,
        "events": [
          {"tick": 0, "notes": [{"s": 4, "f": 7, "dur": 240, "finger": "T"}]},
          {"tick": 240, "notes": [{"s": 3, "f": 5, "dur": 240, "finger": "I"}]},
          {"tick": 480, "notes": [{"s": 2, "f": 0, "dur": 240, "finger": "T"}]},
          {"tick": 720, "notes": [{"s": 1, "f": 0, "dur": 240, "finger": "M"}]},
          {"tick": 960, "notes": [{"s": 3, "f": 0, "dur": 480, "finger": "T"}]},
          {"tick": 1440, "notes": [{"s": 1, "f": 0, "dur": 480, "finger": "M"}, {"s": 2, "f": 0, "dur": 480, "finger": "I"}]}
        ]
      }
    ]
  },
  "reading_list": [
    {"from_measure": 1, "to_measure": 4},
    {"from_measure": 1, "to_measure": 12}
  ],
  "x_source": {
    "type": "local",
    "source_file": "tab-banjo-in-the-ho-12121-4516112422011.tef",
    "converted_at": "2026-07-02T11:24:52.969704"
  }
}
