{
  "otf_version": "1.0",
  "metadata": {
    "title": "Cheyenne",
    "time_signature": "2/2",
    "tempo": 160
  },
  "timing": {
    "ticks_per_beat": 480
  },
  "tracks": [],
  "notation": {},
  "x_source": {
    "type": "banjo-hangout",
    "url": "https://www.hangoutstorage.com/banjohangout.org/storage/tabs/c/tab-cheyenne-28126-43016162025.tef",
    "author": "NickPug",
    "converted_at": "2026-01-03T22:37:36.327625",
    "source_id": "28126"
  }
}
