{
  "otf_version": "1.0",
  "metadata": {
    "title": "Cripple Creek",
    "time_signature": "2/2",
    "tempo": 120,
    "key": "G"
  },
  "timing": {
    "ticks_per_beat": 480
  },
  "tracks": [
    {
      "id": "banjo",
      "instrument": "5-string-banjo",
      "tuning": ["D4", "B3", "G3", "D3", "G4"],
      "capo": 0,
      "role": "lead"
    }
  ],
  "notation": {
    "banjo": [
      {
        "measure": 1,
        "events": [
          {"tick": 0, "notes": [{"s": 1, "f": 5, "dur": 240}]},
          {"tick": 240, "notes": [{"s": 1, "f": 7, "dur": 240, "tech": "h"}]},
          {"tick": 480, "notes": [{"s": 1, "f": 9, "dur": 240}]},
          {"tick": 720, "notes": [{"s": 5, "f": 0, "dur": 240}]},
          {"tick": 960, "notes": [{"s": 1, "f": 0, "dur": 240}]},
          {"tick": 1200, "notes": [{"s": 2, "f": 0, "dur": 240}]},
          {"tick": 1440, "notes": [{"s": 3, "f": 0, "dur": 240}]},
          {"tick": 1680, "notes": [{"s": 5, "f": 0, "dur": 240}]}
        ]
      },
      {
        "measure": 2,
        "events": [
          {"tick": 0, "notes": [{"s": 2, "f": 1, "dur": 480}]},
          {"tick": 480, "notes": [{"s": 1, "f": 2, "dur": 240}, {"s": 2, "f": 1, "dur": 240}, {"s": 3, "f": 0, "dur": 240}]},
          {"tick": 720, "notes": [{"s": 5, "f": 0, "dur": 240}]},
          {"tick": 960, "notes": [{"s": 1, "f": 0, "dur": 240}]},
          {"tick": 1200, "notes": [{"s": 2, "f": 0, "dur": 240}]},
          {"tick": 1440, "notes": [{"s": 3, "f": 0, "dur": 240}]},
          {"tick": 1680, "notes": [{"s": 5, "f": 0, "dur": 240}]}
        ]
      },
      {
        "measure": 3,
        "events": [
          {"tick": 0, "notes": [{"s": 1, "f": 2, "dur": 240}]},
          {"tick": 240, "notes": [{"s": 1, "f": 0, "dur": 240, "tech": "p"}]},
          {"tick": 480, "notes": [{"s": 2, "f": 1, "dur": 240}]},
          {"tick": 720, "notes": [{"s": 1, "f": 2, "dur": 240}]},
          {"tick": 960, "notes": [{"s": 1, "f": 0, "dur": 480}]},
          {"tick": 1440, "notes": [{"s": 1, "f": 0, "dur": 240}, {"s": 2, "f": 0, "dur": 240}, {"s": 3, "f": 0, "dur": 240}]},
          {"tick": 1680, "notes": [{"s": 5, "f": 0, "dur": 240}]}
        ]
      },
      {
        "measure": 4,
        "events": [
          {"tick": 0, "notes": [{"s": 3, "f": 2, "dur": 240}]},
          {"tick": 240, "notes": [{"s": 3, "f": 0, "dur": 240, "tech": "p"}]},
          {"tick": 480, "notes": [{"s": 4, "f": 4, "dur": 480}]},
          {"tick": 960, "notes": [{"s": 3, "f": 0, "dur": 480}]},
          {"tick": 1440, "notes": [{"s": 1, "f": 0, "dur": 240}, {"s": 2, "f": 0, "dur": 240}, {"s": 3, "f": 0, "dur": 240}, {"s": 4, "f": 0, "dur": 240}]},
          {"tick": 1680, "notes": [{"s": 5, "f": 0, "dur": 240}]}
        ]
      },
      {
        "measure": 5,
        "events": [
          {"tick": 0, "notes": [{"s": 2, "f": 0, "dur": 240}]},
          {"tick": 240, "notes": [{"s": 3, "f": 2, "dur": 240}]},
          {"tick": 480, "notes": [{"s": 3, "f": 0, "dur": 240}]},
          {"tick": 720, "notes": [{"s": 3, "f": 4, "dur": 240, "tech": "h"}]},
          {"tick": 960, "notes": [{"s": 3, "f": 2, "dur": 240}]},
          {"tick": 1200, "notes": [{"s": 3, "f": 0, "dur": 240, "tech": "p"}]},
          {"tick": 1440, "notes": [{"s": 3, "f": 2, "dur": 240}]},
          {"tick": 1680, "notes": [{"s": 3, "f": 4, "dur": 240, "tech": "/"}]}
        ]
      },
      {
        "measure": 6,
        "events": [
          {"tick": 0, "notes": [{"s": 2, "f": 0, "dur": 240}]},
          {"tick": 240, "notes": [{"s": 3, "f": 2, "dur": 240}]},
          {"tick": 480, "notes": [{"s": 2, "f": 0, "dur": 240}]},
          {"tick": 720, "notes": [{"s": 2, "f": 1, "dur": 240, "tech": "h"}]},
          {"tick": 960, "notes": [{"s": 1, "f": 0, "dur": 240}]},
          {"tick": 1200, "notes": [{"s": 1, "f": 2, "dur": 240, "tech": "h"}]},
          {"tick": 1440, "notes": [{"s": 1, "f": 0, "dur": 240}]},
          {"tick": 1680, "notes": [{"s": 2, "f": 1, "dur": 240}]}
        ]
      },
      {
        "measure": 7,
        "events": [
          {"tick": 0, "notes": [{"s": 2, "f": 0, "dur": 240}]},
          {"tick": 240, "notes": [{"s": 3, "f": 2, "dur": 240}]},
          {"tick": 480, "notes": [{"s": 3, "f": 0, "dur": 240}]},
          {"tick": 720, "notes": [{"s": 3, "f": 4, "dur": 240, "tech": "h"}]},
          {"tick": 960, "notes": [{"s": 3, "f": 2, "dur": 240}]},
          {"tick": 1200, "notes": [{"s": 3, "f": 0, "dur": 240, "tech": "p"}]},
          {"tick": 1440, "notes": [{"s": 4, "f": 2, "dur": 240}]},
          {"tick": 1680, "notes": [{"s": 4, "f": 0, "dur": 240, "tech": "p"}]}
        ]
      },
      {
        "measure": 8,
        "events": [
          {"tick": 0, "notes": [{"s": 4, "f": 2, "dur": 240}]},
          {"tick": 240, "notes": [{"s": 4, "f": 0, "dur": 240, "tech": "p"}]},
          {"tick": 480, "notes": [{"s": 4, "f": 2, "dur": 240}]},
          {"tick": 720, "notes": [{"s": 4, "f": 4, "dur": 240, "tech": "/"}]},
          {"tick": 960, "notes": [{"s": 3, "f": 0, "dur": 480}]},
          {"tick": 1440, "notes": [{"s": 1, "f": 0, "dur": 240}, {"s": 2, "f": 0, "dur": 240}, {"s": 3, "f": 0, "dur": 240}, {"s": 4, "f": 0, "dur": 240}]},
          {"tick": 1680, "notes": [{"s": 5, "f": 0, "dur": 240}]}
        ]
      }
    ]
  },
  "annotations": [
    {"measure": 3, "tick": 720, "text": "- H"}
  ],
  "reading_list": [
    {"from_measure": 1, "to_measure": 4},
    {"from_measure": 1, "to_measure": 4},
    {"from_measure": 5, "to_measure": 8},
    {"from_measure": 5, "to_measure": 8}
  ],
  "x_source": {
    "type": "banjo-hangout",
    "source_id": "27635",
    "url": "https://www.hangoutstorage.com/banjohangout.org/storage/tabs/c/tab-cripple-creek-27635-352183122024.tef",
    "download_file": "27635_tef_cripple_creek.tef",
    "author": "LyleK",
    "converted_at": "2026-10-17T22:44:19.949635"
  }
}
